{
  "result_id": "result-001",
  "guard_id": "cep-callback-contract-guard",
  "guard_version": "1.0.0",
  "workspace_id": "example-cep",
  "verdict": "INSUFFICIENT_EVIDENCE",
  "summary": "A potentially invalid callback argument was found, but the required narrow runtime reproduction has not been executed.",
  "findings": [
    "Current caller passes callbackValue without a proven function-type contract."
  ],
  "evidence_refs": [
    "workspace:file:cep/client/app.js",
    "memory:failure-pattern:cep-callback-non-function"
  ],
  "validation_refs": [],
  "governance_state": "READ_ONLY",
  "executed_at": "2026-07-25T00:00:00Z"
}
